{
  "$schema": "https://raw.githubusercontent.com/STOF14/HisDeck/main/schemas/plan.schema.json",
  "version": 1,
  "profile": {
    "name": "Sample Student",
    "institution": "Sample University",
    "term": "2026 Semester 1"
  },
  "rules": [
    "3 blocks per day, about 2 hours each",
    "50 min on / 10 min break",
    "Module with the next exam gets Block 1",
    "Sleep 7-8 hours; non-negotiable"
  ],
  "exams": [
    {
      "module": "MATH 101",
      "date": "2026-06-01",
      "time": "09:00",
      "venue": "Main Hall",
      "credits": 12
    },
    {
      "module": "PHYS 101",
      "date": "2026-06-05",
      "time": "13:30",
      "venue": "Science Building",
      "credits": 12
    },
    {
      "module": "CS 101",
      "date": "2026-06-09",
      "time": "08:00",
      "venue": "Lab A",
      "credits": 16
    }
  ],
  "schedule": {
    "2026-05-28": ["MATH 101", "PHYS 101", "CS 101"],
    "2026-05-29": ["MATH 101", "PHYS 101", "CS 101"],
    "2026-05-30": ["MATH 101", "PHYS 101", "CS 101"]
  }
}
